{
  "schema_version": "answer-summary-candidates.v1",
  "session": "令和8年第4回定例会",
  "diet_session_slug": "ishigaki-r8-dai4-teireikai",
  "artifact_type": "answer_summary_candidates",
  "artifact_origin": "generated_from_candidate_inventory",
  "review_status": "reviewer_only",
  "generated_at": "2026-07-14T14:15:38.082Z",
  "generated_from": [
    "docs/general_questions_minutes/candidate-inventory/r8-dai4-teireikai.candidate-inventory.json",
    "docs/general_questions_minutes/utterance-index/r8-dai4-teireikai.utterances.json",
    "docs/general_questions/r8-dai4-teireikai.general-questions.json"
  ],
  "source_inventory_summary": {
    "entries": 108,
    "direct_item_answer_anchors": 91,
    "unknown_answer_like": 7,
    "city_answer_missing": 10,
    "recoverable_answer_entries": 2,
    "recoverable_answer_candidates": 3,
    "question_anchor_missing": 9,
    "speaker_role_unknown_warnings": 53
  },
  "summary": {
    "source_entry_count": 9,
    "generated_entry_count": 9,
    "source_candidate_count": 10,
    "generated_candidate_count": 10,
    "summaries_generated": 3,
    "summaries_held_or_null": 7,
    "review_status_counts": {
      "hold_attribution": 7,
      "pending_review": 3
    },
    "recommended_action_counts": {
      "resolve_speaker_role": 7,
      "review_for_city_answer_summary": 3
    },
    "risk_flag_counts": {
      "answer_role_unknown": 7,
      "speaker_role_unknown": 7,
      "target_topic_uncertain": 2,
      "city_answer_missing": 3,
      "item_match_uncertain": 3,
      "low_confidence_answer_anchor": 3,
      "question_anchor_missing": 3,
      "question_only": 3,
      "recoverable_answer_candidate": 3
    }
  },
  "entries": [
    {
      "entry_id": "ishigaki-r8-dai4-ippan-tomoyose-eizo.item07",
      "question_id": "ishigaki-r8-dai4-ippan-tomoyose-eizo",
      "question_order": 1,
      "questioner_name": "友寄永三",
      "item_index": 7,
      "item_title": "コンサル業務について",
      "question_text": "コンサル業務について: コンサル業務の推移について",
      "inventory_answer_state": {
        "answer_anchor_source": "unknown_answer_like",
        "answer_anchor_confidence": "medium",
        "city_answer_missing": false
      },
      "entry_risk_flags": [
        "answer_role_unknown",
        "speaker_role_unknown",
        "target_topic_uncertain"
      ],
      "review_status": "hold_attribution",
      "recommended_action": "resolve_speaker_role",
      "review_notes": "confirmed_facts phase close 後の reviewer-only answer summary 候補です。公開反映の承認データではありません。",
      "candidates": [
        {
          "candidate_id": "ishigaki-r8-dai4-ippan-tomoyose-eizo.item07::ishigaki-r8-dai4-teireikai.gq.ishigaki-r8-dai4-ippan-tomoyose-eizo.u0019::unknown_answer_like",
          "source_utterance_id": "ishigaki-r8-dai4-teireikai.gq.ishigaki-r8-dai4-ippan-tomoyose-eizo.u0019",
          "source_file": "docs/general_questions_minutes/utterance-index/r8-dai4-teireikai.utterances.json",
          "source_speaker_name": "総務省田原治",
          "source_speaker_role": "unknown",
          "source_text": "友予製造議員の質問7項目目の\nコンサル業務の推移についてお答えいたします\n本市におきましては\n施設の維持管理建設事業に関連する設計管理\nさらには地域振興や環境保全社会福祉など\n多岐にわたる業務に対して委託を行っております\nこれらの業務は専門的な知見や技術を要するものであり\n外部の専門家への委託を通じて\nより高い専門性を確保し\n効率的な業務運営を図ることを目的としているところでございます\nコンサルティング事業者への業務委託につきましては\n主に本市が策定する各種計画の策定等に係る業務支援について委託を行っております\n本市のコンサルティング業務委託を含めた全委託に係る決算額につきましては\n令和3年度37億2419万円、令和4年度38億9267万円、令和5年度36億2302万円、\n令和6年度41億7523万円、令和7年度44億7136万円となっております。\nそのうち、各種構想や計画策定に係るコンサルティング事業の委託額の推移につきましては、\n同じく決算ベースで令和3年度1億1,842万6千円\n令和4年度5,851万7千円\n令和5年度8,952万4千円\n令和6年度1億3,101万7千円\n令和7年度5,089万1千円となっております",
          "source_line_start": 224,
          "source_line_end": 244,
          "anchor_type": "unknown_answer_like",
          "answer_confidence": "medium",
          "fallback_used": false,
          "summary_basis": null,
          "reviewed_speaker_name": "総務省田原治",
          "reviewed_speaker_role": "executive",
          "attribution_confidence": "medium",
          "attribution_basis": "議長側の答弁要求後に、当該itemへの「お答えいたします」で始まり、次発話で答弁終了が示されている。ただしspeaker表記が文字起こし上「総務省田原治」となっており、正確な役職名を確定できない。",
          "attribution_review_notes": "市側答弁ブロックとしては妥当だが、役職名の文字起こし崩れが残るためsummary化は保留。",
          "item_match_confidence": "high",
          "item_match_basis": "source utteranceが「7項目目のコンサル業務の推移について」と明示している。",
          "item_match_review_notes": "item 7との対応は直接確認できる。",
          "candidate_summary": null,
          "candidate_review_status": "hold_attribution",
          "recommended_action": "resolve_speaker_role",
          "risk_flags": [
            "answer_role_unknown",
            "speaker_role_unknown",
            "target_topic_uncertain"
          ],
          "review_notes": "speaker attribution remains medium; keep summary null until role/name is confirmed."
        }
      ]
    },
    {
      "entry_id": "ishigaki-r8-dai4-ippan-shiuezato-atsushi.item01",
      "question_id": "ishigaki-r8-dai4-ippan-shiuezato-atsushi",
      "question_order": 2,
      "questioner_name": "後上里厚司",
      "item_index": 1,
      "item_title": "市職員の窓口での対応について",
      "question_text": "市職員の窓口での対応について: 対応向上のための人材育成について",
      "inventory_answer_state": {
        "answer_anchor_source": "unknown_answer_like",
        "answer_anchor_confidence": "medium",
        "city_answer_missing": false
      },
      "entry_risk_flags": [
        "answer_role_unknown",
        "speaker_role_unknown",
        "target_topic_uncertain"
      ],
      "review_status": "hold_attribution",
      "recommended_action": "resolve_speaker_role",
      "review_notes": "confirmed_facts phase close 後の reviewer-only answer summary 候補です。公開反映の承認データではありません。",
      "candidates": [
        {
          "candidate_id": "ishigaki-r8-dai4-ippan-shiuezato-atsushi.item01::ishigaki-r8-dai4-teireikai.gq.ishigaki-r8-dai4-ippan-shiuezato-atsushi.u0006::unknown_answer_like",
          "source_utterance_id": "ishigaki-r8-dai4-teireikai.gq.ishigaki-r8-dai4-ippan-shiuezato-atsushi.u0006",
          "source_file": "docs/general_questions_minutes/utterance-index/r8-dai4-teireikai.utterances.json",
          "source_speaker_name": "総務省田原総務",
          "source_speaker_role": "unknown",
          "source_text": "市委員長と厚生労働省の質問の1項目目\n市職員の窓口での対応についてお答えいたします\n職員の窓口対応につきましては\nこれまでも機会あるごとに研修等を実施するなどして\n接遇マナーの向上に努めているところですが\n依然として市民より職員の対応に対する苦情が多数寄せられております\n市民意見箱やメール等で実際にいただいているご意見といたしましては\n窓口に出向いた際に職員が出てこない\n担当者が不在のため対応ができない\n接客態度が横平で上から目線の物言いをされたなどのご指摘を受けております\n職員に対しましては常に丁寧な対応を心がけるよう文書にて通知を行うとともに\n管理監督者においては所属職員に対する見出し並みを含めた\n接遇指導にあたるよう周知徹底に努めているところでございます\n職員ご指摘の接遇対応向上のため\nこれまでも接遇研修を実施してまいりました\n研修では職員一人一人が相手の立場に配慮した\n思いやりの行動や言葉遣い等を実践するための\n知識やスキルの習得を行います\nまた各職場においては管理監督者が率先推判して\n接遇を実践することや部下の能力や性格に応じた指導を行うことにより\n組織全体の接遇力の底上げにつながるものと考えます\n本市といたしましては窓口対応に対する市民の皆様からのご意見を真摯に受け止め\n接遇面を含めた窓口業務の改善\n職員の意識改革に引き続き取り組んでまいります",
          "source_line_start": 25,
          "source_line_end": 48,
          "anchor_type": "unknown_answer_like",
          "answer_confidence": "medium",
          "fallback_used": false,
          "summary_basis": null,
          "reviewed_speaker_name": "総務省田原総務",
          "reviewed_speaker_role": "executive",
          "attribution_confidence": "medium",
          "attribution_basis": "議長側の答弁要求後に、item 1「市職員の窓口での対応について」へ回答している。ただしspeaker表記が文字起こし上「総務省田原総務」と崩れており、正確な役職・氏名を確定できない。",
          "attribution_review_notes": "市側答弁としての位置付けは強いが、役職名の確度不足によりsummary化は保留。",
          "item_match_confidence": "high",
          "item_match_basis": "source utteranceが「1項目目 市職員の窓口での対応について」と明示している。",
          "item_match_review_notes": "item 1との対応は直接確認できる。",
          "candidate_summary": null,
          "candidate_review_status": "hold_attribution",
          "recommended_action": "resolve_speaker_role",
          "risk_flags": [
            "answer_role_unknown",
            "speaker_role_unknown",
            "target_topic_uncertain"
          ],
          "review_notes": "speaker attribution remains medium; keep summary null until role/name is confirmed."
        }
      ]
    },
    {
      "entry_id": "ishigaki-r8-dai4-ippan-shiuezato-atsushi.item04",
      "question_id": "ishigaki-r8-dai4-ippan-shiuezato-atsushi",
      "question_order": 2,
      "questioner_name": "後上里厚司",
      "item_index": 4,
      "item_title": "石垣・台湾定期航路",
      "question_text": "石垣・台湾定期航路: 航行にかかる費用 / 人流だけで採算はとれるのか。 / どの程度の物流があれば採算がとれるのか。",
      "inventory_answer_state": {
        "answer_anchor_source": "none",
        "answer_anchor_confidence": "low",
        "city_answer_missing": true
      },
      "entry_risk_flags": [
        "city_answer_missing",
        "item_match_uncertain",
        "low_confidence_answer_anchor",
        "question_anchor_missing",
        "question_only",
        "recoverable_answer_candidate"
      ],
      "review_status": "pending_review",
      "recommended_action": "review_for_city_answer_summary",
      "review_notes": "confirmed_facts phase close 後の reviewer-only answer summary 候補です。公開反映の承認データではありません。",
      "candidates": [
        {
          "candidate_id": "ishigaki-r8-dai4-ippan-shiuezato-atsushi.item04::ishigaki-r8-dai4-teireikai.gq.ishigaki-r8-dai4-ippan-shiuezato-atsushi.u0010::null_item_proximity",
          "source_utterance_id": "ishigaki-r8-dai4-teireikai.gq.ishigaki-r8-dai4-ippan-shiuezato-atsushi.u0010",
          "source_file": "docs/general_questions_minutes/utterance-index/r8-dai4-teireikai.utterances.json",
          "source_speaker_name": "企画部長 菅沼副",
          "source_speaker_role": "executive",
          "source_text": "石垣・キールン定期航路について3点ご質問がありますので\n順を追ってお答えします\n1点目の就航に係る費用については\n年度費や石垣港・キールン港の港費など運航に関する費用\n船員費 潤滑油費 船舶保険料などの船にかかる費用\n船舶代理店や警備等の委託費用など\nそれらをすべて計上し\n航行にかかる費用として算出する必要があります\n5月28日の初就航日直後であることから\n実績ベースの生産額は確定していませんので\nお答えできません\n2点目の人流だけでの採算についてと\n3点目の物流の採算性については\n検討委員会の報告書にも記載されているように\n旅客運送に加え貨物も積載することが\n安定的な運行に不可欠であり\n当初のシミュレーションにおいても\n乗船率50%貨物約10%程度は必要であると想定しています\n昨今の原油高の状況を鑑みると\n原油価格や為替動向等の外部環境を踏まえながら\n利用促進及び収支改善に取り組む必要があると認識しています",
          "source_line_start": 113,
          "source_line_end": 133,